{
  "handler_id": "secretary.code-router",
  "version": "1.0.0-rc2",
  "kind": "CODE",
  "maturity": "C2",
  "evidence": "E2",
  "supported_node_ids": ["secretary.route"],
  "deterministic": true,
  "network_required": false,
  "api_token_required": false,
  "proposal_only": true,
  "provider_family": "DETERMINISTIC_CODE"
}
