{
  "handler_id": "secretary.manual-brain",
  "version": "1.0.0-rc2",
  "kind": "MANUAL_HOST",
  "maturity": "C1",
  "evidence": "E1",
  "supported_node_ids": ["secretary.route", "secretary.reason"],
  "deterministic": false,
  "network_required": false,
  "api_token_required": false,
  "proposal_only": true,
  "provider_family": "PORTABLE_MANUAL_HOST"
}
